,Spanish,English,Audio
0,La acreditación es necesaria para ingresar al evento.,The accreditation is necessary to enter the event.,./Sentences/Administración y Gerencia/audio/0_Administración y Gerencia_audio.mp3
1,La administración de la empresa está implementando nuevas políticas.,The company's administration is implementing new policies.,./Sentences/Administración y Gerencia/audio/1_Administración y Gerencia_audio.mp3
2,El personal administrativo está trabajando en un informe importante.,The administrative staff is working on an important report.,./Sentences/Administración y Gerencia/audio/2_Administración y Gerencia_audio.mp3
3,Debes pasar por la aduana antes de salir del país.,You must go through customs before leaving the country.,./Sentences/Administración y Gerencia/audio/3_Administración y Gerencia_audio.mp3
4,Llegaré al aeropuerto una hora antes de mi vuelo.,I will arrive at the airport an hour before my flight.,./Sentences/Administración y Gerencia/audio/4_Administración y Gerencia_audio.mp3
5,El alto riesgo de la inversión no detuvo al empresario.,The high risk of the investment did not deter the entrepreneur.,./Sentences/Administración y Gerencia/audio/5_Administración y Gerencia_audio.mp3
6,El análisis financiero reveló la salud económica de la empresa.,The financial analysis revealed the economic health of the company.,./Sentences/Administración y Gerencia/audio/6_Administración y Gerencia_audio.mp3
7,El apartamento tiene una hermosa vista al mar.,The apartment has a beautiful ocean view.,./Sentences/Administración y Gerencia/audio/7_Administración y Gerencia_audio.mp3
8,Voy a arreglar la reunión para la próxima semana.,I will arrange the meeting for next week.,./Sentences/Administración y Gerencia/audio/8_Administración y Gerencia_audio.mp3
9,El gerente va a asignar nuevas responsabilidades al equipo.,The manager is going to assign new responsibilities to the team.,./Sentences/Administración y Gerencia/audio/9_Administración y Gerencia_audio.mp3
10,Tomaré el autobús para ir al centro de la ciudad.,I will take the bus to go to the city center.,./Sentences/Administración y Gerencia/audio/10_Administración y Gerencia_audio.mp3
11,Mi automóvil necesita una revisión en el taller.,My car needs a check-up at the garage.,./Sentences/Administración y Gerencia/audio/11_Administración y Gerencia_audio.mp3
12,Voy al banco a hacer un depósito.,I am going to the bank to make a deposit.,./Sentences/Administración y Gerencia/audio/12_Administración y Gerencia_audio.mp3
13,Los beneficios de la empresa aumentaron este trimestre.,The company's benefits increased this quarter.,./Sentences/Administración y Gerencia/audio/13_Administración y Gerencia_audio.mp3
14,Compré el boleto para el concierto de rock.,I bought the ticket for the rock concert.,./Sentences/Administración y Gerencia/audio/14_Administración y Gerencia_audio.mp3
15,El candidato presentó su propuesta de campaña.,The candidate presented his campaign proposal.,./Sentences/Administración y Gerencia/audio/15_Administración y Gerencia_audio.mp3
16,Recibí capacitación en técnicas de ventas.,I received training in sales techniques.,./Sentences/Administración y Gerencia/audio/16_Administración y Gerencia_audio.mp3
17,El carro necesita una reparación urgente.,The car needs an urgent repair.,./Sentences/Administración y Gerencia/audio/17_Administración y Gerencia_audio.mp3
18,Vamos a alquilar un coche para nuestras vacaciones.,We are going to rent a car for our vacation.,./Sentences/Administración y Gerencia/audio/18_Administración y Gerencia_audio.mp3
19,El combustible del avión está siendo cargado antes del despegue.,The airplane's fuel is being loaded before takeoff.,./Sentences/Administración y Gerencia/audio/19_Administración y Gerencia_audio.mp3
20,La compañía está experimentando un crecimiento significativo este año.,The company is experiencing significant growth this year.,./Sentences/Administración y Gerencia/audio/20_Administración y Gerencia_audio.mp3
21,Me encanta ir de compras los fines de semana.,I love going shopping on weekends.,./Sentences/Administración y Gerencia/audio/21_Administración y Gerencia_audio.mp3
22,Las concesiones para el nuevo proyecto fueron aprobadas por el gobierno.,The concessions for the new project were approved by the government.,./Sentences/Administración y Gerencia/audio/22_Administración y Gerencia_audio.mp3
23,El conductor del autobús nos llevó de manera segura a nuestro destino.,The bus driver safely took us to our destination.,./Sentences/Administración y Gerencia/audio/23_Administración y Gerencia_audio.mp3
24,El consejo decidió implementar nuevas políticas para mejorar la productividad.,The board decided to implement new policies to improve productivity.,./Sentences/Administración y Gerencia/audio/24_Administración y Gerencia_audio.mp3
25,La construcción del nuevo edificio comenzará el próximo mes.,The construction of the new building will start next month.,./Sentences/Administración y Gerencia/audio/25_Administración y Gerencia_audio.mp3
26,El contrato fue firmado por ambas partes ayer por la tarde.,The contract was signed by both parties yesterday afternoon.,./Sentences/Administración y Gerencia/audio/26_Administración y Gerencia_audio.mp3
27,El costo de vida en esta ciudad es bastante alto.,The cost of living in this city is quite high.,./Sentences/Administración y Gerencia/audio/27_Administración y Gerencia_audio.mp3
28,Ese vestido es demasiado costoso para mi presupuesto.,That dress is too expensive for my budget.,./Sentences/Administración y Gerencia/audio/28_Administración y Gerencia_audio.mp3
29,Necesitarás una credencial válida para ingresar al edificio.,You will need a valid credential to enter the building.,./Sentences/Administración y Gerencia/audio/29_Administración y Gerencia_audio.mp3
30,El crédito hipotecario facilitó la compra de nuestra casa.,The mortgage credit made it easier to buy our house.,./Sentences/Administración y Gerencia/audio/30_Administración y Gerencia_audio.mp3
31,¿Puedes revisar mi cuenta bancaria para ver si se realizó el depósito?,Can you check my bank account to see if the deposit was made?,./Sentences/Administración y Gerencia/audio/31_Administración y Gerencia_audio.mp3
32,El currículo vitae de la candidata destacaba su experiencia internacional.,The candidate's resume highlighted her international experience.,./Sentences/Administración y Gerencia/audio/32_Administración y Gerencia_audio.mp3
33,La empresa decidió despedir a varios empleados debido a la reestructuración.,The company decided to lay off several employees due to restructuring.,./Sentences/Administración y Gerencia/audio/33_Administración y Gerencia_audio.mp3
34,El despido del gerente sorprendió a todos en la oficina.,The manager's dismissal surprised everyone in the office.,./Sentences/Administración y Gerencia/audio/34_Administración y Gerencia_audio.mp3
35,Los fondos se destinarán a proyectos de desarrollo comunitario.,The funds will be allocated to community development projects.,./Sentences/Administración y Gerencia/audio/35_Administración y Gerencia_audio.mp3
36,La deuda de la empresa se redujo significativamente el año pasado.,The company's debt was significantly reduced last year.,./Sentences/Administración y Gerencia/audio/36_Administración y Gerencia_audio.mp3
37,La discriminación en el lugar de trabajo es inaceptable.,Discrimination in the workplace is unacceptable.,./Sentences/Administración y Gerencia/audio/37_Administración y Gerencia_audio.mp3
38,El dormitorio principal tiene un baño en suite.,The master bedroom has an en-suite bathroom.,./Sentences/Administración y Gerencia/audio/38_Administración y Gerencia_audio.mp3
39,El dueño del restaurante nos dio la bienvenida con una sonrisa.,The restaurant owner welcomed us with a smile.,./Sentences/Administración y Gerencia/audio/39_Administración y Gerencia_audio.mp3
40,El edificio tiene una arquitectura moderna y elegante.,The building has a modern and elegant architecture.,./Sentences/Administración y Gerencia/audio/40_Administración y Gerencia_audio.mp3
41,La educación es fundamental para el desarrollo de un país.,Education is fundamental for the development of a country.,./Sentences/Administración y Gerencia/audio/41_Administración y Gerencia_audio.mp3
42,La electricidad es una forma de energía muy utilizada en la actualidad.,Electricity is a form of energy widely used nowadays.,./Sentences/Administración y Gerencia/audio/42_Administración y Gerencia_audio.mp3
43,El enlace entre los dos departamentos es crucial para el éxito del proyecto.,The link between the two departments is crucial for the project's success.,./Sentences/Administración y Gerencia/audio/43_Administración y Gerencia_audio.mp3
44,El entrenamiento físico es esencial para mantenerse en forma.,Physical training is essential to stay in shape.,./Sentences/Administración y Gerencia/audio/44_Administración y Gerencia_audio.mp3
45,La entrevista de empleo determinará si consigo el trabajo.,The job interview will determine if I get the job.,./Sentences/Administración y Gerencia/audio/45_Administración y Gerencia_audio.mp3
46,La escuela donde estudio tiene excelentes instalaciones.,The school where I study has excellent facilities.,./Sentences/Administración y Gerencia/audio/46_Administración y Gerencia_audio.mp3
47,Facilitar la información necesaria agilizará el proceso.,Providing the necessary information will expedite the process.,./Sentences/Administración y Gerencia/audio/47_Administración y Gerencia_audio.mp3
48,La factura del teléfono llegó más cara de lo esperado.,The phone bill came out more expensive than expected.,./Sentences/Administración y Gerencia/audio/48_Administración y Gerencia_audio.mp3
49,Las finanzas de la empresa están en buen estado.,The company's finances are in good shape.,./Sentences/Administración y Gerencia/audio/49_Administración y Gerencia_audio.mp3
50,El flete de la mercancía se realizará la próxima semana.,The freight of the merchandise will take place next week.,./Sentences/Administración y Gerencia/audio/50_Administración y Gerencia_audio.mp3
51,Los fondos para el proyecto provienen de diferentes fuentes.,The funds for the project come from different sources.,./Sentences/Administración y Gerencia/audio/51_Administración y Gerencia_audio.mp3
52,El gasto en comida representa la mayor parte de mi presupuesto.,The expense on food represents the majority of my budget.,./Sentences/Administración y Gerencia/audio/52_Administración y Gerencia_audio.mp3
53,El hogar es un lugar de descanso y tranquilidad.,Home is a place of rest and tranquility.,./Sentences/Administración y Gerencia/audio/53_Administración y Gerencia_audio.mp3
54,El hospedaje en el hotel fue muy cómodo y agradable.,The lodging at the hotel was very comfortable and pleasant.,./Sentences/Administración y Gerencia/audio/54_Administración y Gerencia_audio.mp3
55,El hospital cuenta con un equipo médico altamente calificado.,The hospital has a highly qualified medical team.,./Sentences/Administración y Gerencia/audio/55_Administración y Gerencia_audio.mp3
56,Los impuestos son necesarios para el funcionamiento del gobierno.,Taxes are necessary for the government's operation.,./Sentences/Administración y Gerencia/audio/56_Administración y Gerencia_audio.mp3
57,El incendio en el bosque fue controlado por los bomberos.,The fire in the forest was controlled by the firefighters.,./Sentences/Administración y Gerencia/audio/57_Administración y Gerencia_audio.mp3
58,La inmobiliaria tiene varias opciones de vivienda disponibles.,The real estate agency has several housing options available.,./Sentences/Administración y Gerencia/audio/58_Administración y Gerencia_audio.mp3
59,Instalar el nuevo software llevará un par de horas.,Installing the new software will take a couple of hours.,./Sentences/Administración y Gerencia/audio/59_Administración y Gerencia_audio.mp3
60,La ley es fundamental para mantener el orden en la sociedad.,The law is essential to maintain order in society.,./Sentences/Administración y Gerencia/audio/60_Administración y Gerencia_audio.mp3
61,Las leyes laborales protegen los derechos de los trabajadores.,Labor laws protect the rights of workers.,./Sentences/Administración y Gerencia/audio/61_Administración y Gerencia_audio.mp3
62,El mantenimiento de edificios es crucial para garantizar la seguridad de los ocupantes.,Building maintenance is crucial to ensure the safety of the occupants.,./Sentences/Administración y Gerencia/audio/62_Administración y Gerencia_audio.mp3
63,El médico recetó medicamentos para tratar la infección.,The doctor prescribed medication to treat the infection.,./Sentences/Administración y Gerencia/audio/63_Administración y Gerencia_audio.mp3
64,La mudanza a una nueva ciudad puede ser emocionante y estresante al mismo tiempo.,Moving to a new city can be exciting and stressful at the same time.,./Sentences/Administración y Gerencia/audio/64_Administración y Gerencia_audio.mp3
65,El oficial administrativo se encarga de la gestión de documentos y archivos.,The administrative officer is in charge of managing documents and files.,./Sentences/Administración y Gerencia/audio/65_Administración y Gerencia_audio.mp3
66,El oficial de asuntos financieros supervisa las operaciones financieras de la empresa.,The financial affairs officer oversees the financial operations of the company.,./Sentences/Administración y Gerencia/audio/66_Administración y Gerencia_audio.mp3
67,El oficial de enlace facilita la comunicación entre diferentes departamentos.,The liaison officer facilitates communication between different departments.,./Sentences/Administración y Gerencia/audio/67_Administración y Gerencia_audio.mp3
68,El oficial de personal se encarga de contratar y capacitar a los empleados.,The personnel officer is in charge of hiring and training employees.,./Sentences/Administración y Gerencia/audio/68_Administración y Gerencia_audio.mp3
69,El pago se realizará al finalizar el proyecto.,The payment will be made upon completion of the project.,./Sentences/Administración y Gerencia/audio/69_Administración y Gerencia_audio.mp3
70,El papeleo puede ser abrumador al solicitar un préstamo hipotecario.,The paperwork can be overwhelming when applying for a mortgage loan.,./Sentences/Administración y Gerencia/audio/70_Administración y Gerencia_audio.mp3
71,El personal de la empresa está altamente capacitado para enfrentar desafíos.,The company's staff is highly trained to face challenges.,./Sentences/Administración y Gerencia/audio/71_Administración y Gerencia_audio.mp3
72,La pertenencia a un club exclusivo conlleva ciertos privilegios.,Belonging to an exclusive club entails certain privileges.,./Sentences/Administración y Gerencia/audio/72_Administración y Gerencia_audio.mp3
73,La piscina del hotel es perfecta para relajarse después de un día ajetreado.,The hotel's pool is perfect for relaxing after a busy day.,./Sentences/Administración y Gerencia/audio/73_Administración y Gerencia_audio.mp3
74,El precio del producto incluye el envío a domicilio.,The price of the product includes home delivery.,./Sentences/Administración y Gerencia/audio/74_Administración y Gerencia_audio.mp3
75,"El presupuesto para el proyecto es limitado, por lo que debemos administrarlo con cuidado.","The budget for the project is limited, so we must manage it carefully.",./Sentences/Administración y Gerencia/audio/75_Administración y Gerencia_audio.mp3
76,Las propiedades en esta zona son muy codiciadas debido a su ubicación privilegiada.,Properties in this area are highly sought after due to their prime location.,./Sentences/Administración y Gerencia/audio/76_Administración y Gerencia_audio.mp3
77,El proveedor de materiales de construcción entregará el pedido mañana.,The construction materials supplier will deliver the order tomorrow.,./Sentences/Administración y Gerencia/audio/77_Administración y Gerencia_audio.mp3
78,El recorte de gastos fue necesario para mantener la rentabilidad de la empresa.,Cost cutting was necessary to maintain the company's profitability.,./Sentences/Administración y Gerencia/audio/78_Administración y Gerencia_audio.mp3
79,Los recursos financieros son fundamentales para el crecimiento de la empresa.,Financial resources are essential for the company's growth.,./Sentences/Administración y Gerencia/audio/79_Administración y Gerencia_audio.mp3
80,Los recursos humanos son el activo más valioso de cualquier organización.,Human resources are the most valuable asset of any organization.,./Sentences/Administración y Gerencia/audio/80_Administración y Gerencia_audio.mp3
81,La remuneración debe ser justa y acorde al trabajo realizado.,The remuneration should be fair and commensurate with the work performed.,./Sentences/Administración y Gerencia/audio/81_Administración y Gerencia_audio.mp3
82,Es importante reparar cualquier daño causado a la reputación de la empresa.,It's important to repair any damage caused to the company's reputation.,./Sentences/Administración y Gerencia/audio/82_Administración y Gerencia_audio.mp3
83,El requisito para este puesto es tener experiencia previa en ventas.,The requirement for this position is to have previous experience in sales.,./Sentences/Administración y Gerencia/audio/83_Administración y Gerencia_audio.mp3
84,Resolveremos el problema lo antes posible.,We will solve the problem as soon as possible.,./Sentences/Administración y Gerencia/audio/84_Administración y Gerencia_audio.mp3
85,El salario mínimo ha aumentado este año.,The minimum wage has increased this year.,./Sentences/Administración y Gerencia/audio/85_Administración y Gerencia_audio.mp3
86,La salud de los empleados es una prioridad para la empresa.,The health of the employees is a priority for the company.,./Sentences/Administración y Gerencia/audio/86_Administración y Gerencia_audio.mp3
87,La sección administrativa se encarga de la gestión de documentos y trámites.,The administrative section is in charge of document management and procedures.,./Sentences/Administración y Gerencia/audio/87_Administración y Gerencia_audio.mp3
88,El sector inmobiliario está experimentando un auge en este momento.,The real estate sector is experiencing a boom at the moment.,./Sentences/Administración y Gerencia/audio/88_Administración y Gerencia_audio.mp3
89,El servicio al cliente es excepcional en esta tienda.,The customer service is exceptional in this store.,./Sentences/Administración y Gerencia/audio/89_Administración y Gerencia_audio.mp3
90,El servicio de calidad es nuestro compromiso con los clientes.,Quality service is our commitment to customers.,./Sentences/Administración y Gerencia/audio/90_Administración y Gerencia_audio.mp3
91,"Los servicios generales incluyen limpieza, mantenimiento y seguridad.","General services include cleaning, maintenance, and security.",./Sentences/Administración y Gerencia/audio/91_Administración y Gerencia_audio.mp3
92,Los sistemas de información son vitales para el funcionamiento de la empresa.,Information systems are vital for the operation of the company.,./Sentences/Administración y Gerencia/audio/92_Administración y Gerencia_audio.mp3
93,La solvencia financiera es un indicador importante para los inversionistas.,Financial solvency is an important indicator for investors.,./Sentences/Administración y Gerencia/audio/93_Administración y Gerencia_audio.mp3
94,El subsidio de desempleo ayuda a las personas en momentos difíciles.,Unemployment benefits help people in difficult times.,./Sentences/Administración y Gerencia/audio/94_Administración y Gerencia_audio.mp3
95,Mi sueldo actual me permite vivir cómodamente.,My current salary allows me to live comfortably.,./Sentences/Administración y Gerencia/audio/95_Administración y Gerencia_audio.mp3
96,La tecnología está transformando la forma en que hacemos negocios.,Technology is transforming the way we do business.,./Sentences/Administración y Gerencia/audio/96_Administración y Gerencia_audio.mp3
97,La transacción se realizó sin problemas.,The transaction was carried out smoothly.,./Sentences/Administración y Gerencia/audio/97_Administración y Gerencia_audio.mp3
98,El transporte público es muy eficiente en esta ciudad.,Public transportation is very efficient in this city.,./Sentences/Administración y Gerencia/audio/98_Administración y Gerencia_audio.mp3
99,"¿Puedes trasladar estas cajas al almacén, por favor?","Can you move these boxes to the warehouse, please?",./Sentences/Administración y Gerencia/audio/99_Administración y Gerencia_audio.mp3
100,El traslado de la oficina a la nueva ubicación fue un éxito.,The office relocation to the new location was a success.,./Sentences/Administración y Gerencia/audio/100_Administración y Gerencia_audio.mp3
101,Contraté una empresa para el traslado de mis pertenencias a la nueva casa.,I hired a company for the transfer of my belongings to the new house.,./Sentences/Administración y Gerencia/audio/101_Administración y Gerencia_audio.mp3
102,Estoy deseando ir de vacaciones a la playa.,I am looking forward to going on vacation to the beach.,./Sentences/Administración y Gerencia/audio/102_Administración y Gerencia_audio.mp3
103,Hay una vacante para un puesto de gerente en la empresa.,There is a vacancy for a manager position in the company.,./Sentences/Administración y Gerencia/audio/103_Administración y Gerencia_audio.mp3
104,La vacunación contra la gripe es importante para prevenir enfermedades.,Influenza vaccination is important for preventing illnesses.,./Sentences/Administración y Gerencia/audio/104_Administración y Gerencia_audio.mp3
105,Encontré una vivienda perfecta en el centro de la ciudad.,I found a perfect housing in the city center.,./Sentences/Administración y Gerencia/audio/105_Administración y Gerencia_audio.mp3
106,Mi vuelo a París sale a las 10 de la mañana.,My flight to Paris leaves at 10 in the morning.,./Sentences/Administración y Gerencia/audio/106_Administración y Gerencia_audio.mp3
107,El alquiler del apartamento es bastante caro en esta zona.,The rent for the apartment is quite expensive in this area.,./Sentences/Administración y Gerencia/audio/107_Administración y Gerencia_audio.mp3
108,La instalación de la nueva red de internet fue un proceso largo.,The installation of the new internet network was a lengthy process.,./Sentences/Administración y Gerencia/audio/108_Administración y Gerencia_audio.mp3
