,Spanish,English,Audio
0,El abogar por los derechos humanos es fundamental en una sociedad justa.,Advocating for human rights is essential in a just society.,./Sentences/Economia/audio/0_Economia_audio.mp3
1,Las acciones de la empresa han aumentado un 10% este trimestre.,The company's stocks have increased by 10% this quarter.,./Sentences/Economia/audio/1_Economia_audio.mp3
2,El acuerdo de paz fue firmado por ambas partes en el conflicto.,The peace agreement was signed by both parties in the conflict.,./Sentences/Economia/audio/2_Economia_audio.mp3
3,La advertencia sobre el huracán se emitió con anticipación.,The warning about the hurricane was issued in advance.,./Sentences/Economia/audio/3_Economia_audio.mp3
4,La contaminación puede afectar la calidad del aire que respiramos.,Pollution can affect the quality of the air we breathe.,./Sentences/Economia/audio/4_Economia_audio.mp3
5,El sector agrícola es vital para la economía de muchos países.,The agricultural sector is vital for the economy of many countries.,./Sentences/Economia/audio/5_Economia_audio.mp3
6,La agricultura sostenible es clave para preservar el medio ambiente.,Sustainable agriculture is key to preserving the environment.,./Sentences/Economia/audio/6_Economia_audio.mp3
7,El ahorro de energía es importante para reducir el impacto ambiental.,Saving energy is important to reduce environmental impact.,./Sentences/Economia/audio/7_Economia_audio.mp3
8,El aliado estratégico nos brindó su apoyo en la negociación.,The strategic ally provided us with their support in the negotiation.,./Sentences/Economia/audio/8_Economia_audio.mp3
9,El análisis del mercado indica una tendencia al alza en las ventas.,The market analysis indicates an upward trend in sales.,./Sentences/Economia/audio/9_Economia_audio.mp3
10,El análisis económico revela la necesidad de implementar medidas fiscales.,The economic analysis reveals the need to implement fiscal measures.,./Sentences/Economia/audio/10_Economia_audio.mp3
11,El analista financiero recomendó diversificar las inversiones.,The financial analyst recommended diversifying the investments.,./Sentences/Economia/audio/11_Economia_audio.mp3
12,El apoyo de la comunidad fue fundamental para el éxito del proyecto.,The support of the community was fundamental for the success of the project.,./Sentences/Economia/audio/12_Economia_audio.mp3
13,Los artículos/commodities básicos son esenciales para la vida diaria.,Basic commodities are essential for daily life.,./Sentences/Economia/audio/13_Economia_audio.mp3
14,El acceso a la educación debe ser asequible para todos.,Access to education should be affordable for everyone.,./Sentences/Economia/audio/14_Economia_audio.mp3
15,El asesor financiero brindó recomendaciones para mejorar la gestión de fondos.,The financial advisor provided recommendations to improve fund management.,./Sentences/Economia/audio/15_Economia_audio.mp3
16,El asunto de la reunión será la planificación del próximo evento.,The subject of the meeting will be the planning of the next event.,./Sentences/Economia/audio/16_Economia_audio.mp3
17,Aumentar la productividad es uno de los objetivos principales de la empresa.,Increasing productivity is one of the main goals of the company.,./Sentences/Economia/audio/17_Economia_audio.mp3
18,La austeridad fiscal puede generar tensiones sociales si no se gestiona adecuadamente.,Fiscal austerity can generate social tensions if not managed properly.,./Sentences/Economia/audio/18_Economia_audio.mp3
19,La ayuda financiera fue crucial para la recuperación después del desastre natural.,Financial aid was crucial for the recovery after the natural disaster.,./Sentences/Economia/audio/19_Economia_audio.mp3
20,La bancarrota puede ser devastadora para una empresa.,Bankruptcy can be devastating for a company.,./Sentences/Economia/audio/20_Economia_audio.mp3
21,El banco está cerrado los fines de semana.,The bank is closed on weekends.,./Sentences/Economia/audio/21_Economia_audio.mp3
22,Las barreras comerciales dificultan el comercio internacional.,Trade barriers hinder international commerce.,./Sentences/Economia/audio/22_Economia_audio.mp3
23,Muchas empresas se beneficiarán de esta nueva ley.,Many companies will benefit from this new law.,./Sentences/Economia/audio/23_Economia_audio.mp3
24,Los bienes personales deben ser declarados en la aduana.,Personal belongings must be declared at customs.,./Sentences/Economia/audio/24_Economia_audio.mp3
25,El bienestar de los empleados es una prioridad para la empresa.,Employee well-being is a priority for the company.,./Sentences/Economia/audio/25_Economia_audio.mp3
26,Existe una brecha salarial significativa entre hombres y mujeres.,There is a significant wage gap between men and women.,./Sentences/Economia/audio/26_Economia_audio.mp3
27,Voy a brindar por el éxito de tu nuevo proyecto.,I will toast to the success of your new project.,./Sentences/Economia/audio/27_Economia_audio.mp3
28,Levantemos nuestras copas para hacer un brindis.,Let's raise our glasses to make a toast.,./Sentences/Economia/audio/28_Economia_audio.mp3
29,La burbuja económica finalmente estalló.,The economic bubble finally burst.,./Sentences/Economia/audio/29_Economia_audio.mp3
30,La caída del mercado de valores afectó a muchos inversores.,The stock market crash affected many investors.,./Sentences/Economia/audio/30_Economia_audio.mp3
31,El campesino cosechó una gran cantidad de maíz este año.,The farmer harvested a large amount of corn this year.,./Sentences/Economia/audio/31_Economia_audio.mp3
32,La canasta familiar incluye productos de primera necesidad.,The family basket includes essential products.,./Sentences/Economia/audio/32_Economia_audio.mp3
33,Este vestido es demasiado caro para mi presupuesto.,This dress is too expensive for my budget.,./Sentences/Economia/audio/33_Economia_audio.mp3
34,El cibercrimen está en aumento en todo el mundo.,Cybercrime is on the rise worldwide.,./Sentences/Economia/audio/34_Economia_audio.mp3
35,El cibercriminal fue arrestado por robar información confidencial.,The cybercriminal was arrested for stealing confidential information.,./Sentences/Economia/audio/35_Economia_audio.mp3
36,La ciencia ha avanzado mucho en las últimas décadas.,Science has advanced a lot in the last decades.,./Sentences/Economia/audio/36_Economia_audio.mp3
37,El científico recibió un premio por su investigación innovadora.,The scientist received an award for his innovative research.,./Sentences/Economia/audio/37_Economia_audio.mp3
38,La cifra de desempleo ha disminuido este trimestre.,The unemployment figure has decreased this quarter.,./Sentences/Economia/audio/38_Economia_audio.mp3
39,El comercio internacional es fundamental para la economía global.,International trade is essential for the global economy.,./Sentences/Economia/audio/39_Economia_audio.mp3
40,La comisión investigadora presentó su informe final al presidente.,The investigative commission presented its final report to the president.,./Sentences/Economia/audio/40_Economia_audio.mp3
41,La compañía anunció una nueva línea de productos para el próximo trimestre.,The company announced a new product line for the next quarter.,./Sentences/Economia/audio/41_Economia_audio.mp3
42,La competencia en el mercado de tecnología es feroz.,The competition in the technology market is fierce.,./Sentences/Economia/audio/42_Economia_audio.mp3
43,La conferencia sobre cambio climático se llevará a cabo la próxima semana.,The conference on climate change will take place next week.,./Sentences/Economia/audio/43_Economia_audio.mp3
44,El congresista presentó un proyecto de ley para reformar el sistema de salud.,The congresswoman introduced a bill to reform the healthcare system.,./Sentences/Economia/audio/44_Economia_audio.mp3
45,La construcción del nuevo puente comenzará el mes que viene.,The construction of the new bridge will begin next month.,./Sentences/Economia/audio/45_Economia_audio.mp3
46,El consumo de energía ha aumentado en los últimos años.,Energy consumption has increased in recent years.,./Sentences/Economia/audio/46_Economia_audio.mp3
47,El contacto visual es importante en una entrevista de trabajo.,Eye contact is important in a job interview.,./Sentences/Economia/audio/47_Economia_audio.mp3
48,Es contraproducente procrastinar en lugar de abordar los problemas de inmediato.,It's counterproductive to procrastinate instead of addressing the issues immediately.,./Sentences/Economia/audio/48_Economia_audio.mp3
49,La corrupción política es un problema grave en muchos países.,Political corruption is a serious problem in many countries.,./Sentences/Economia/audio/49_Economia_audio.mp3
50,El costo de vida en la ciudad es muy alto.,The cost of living in the city is very high.,./Sentences/Economia/audio/50_Economia_audio.mp3
51,El crecimiento económico ha sido constante durante los últimos años.,Economic growth has been consistent over the past years.,./Sentences/Economia/audio/51_Economia_audio.mp3
52,La crisis económica afectó a millones de personas en todo el mundo.,The economic crisis affected millions of people worldwide.,./Sentences/Economia/audio/52_Economia_audio.mp3
53,Necesito verificar el saldo de mi cuenta bancaria.,I need to check the balance of my bank account.,./Sentences/Economia/audio/53_Economia_audio.mp3
54,La cumbre de líderes mundiales se llevará a cabo en París.,The summit of world leaders will take place in Paris.,./Sentences/Economia/audio/54_Economia_audio.mp3
55,La declaración del testigo fue crucial para el veredicto.,The witness's statement was crucial to the verdict.,./Sentences/Economia/audio/55_Economia_audio.mp3
56,La defensa del acusado presentó pruebas contundentes en el juicio.,The defendant's defense presented compelling evidence in the trial.,./Sentences/Economia/audio/56_Economia_audio.mp3
57,La dependencia de las redes sociales puede tener efectos negativos en la salud mental.,Dependence on social media can have negative effects on mental health.,./Sentences/Economia/audio/57_Economia_audio.mp3
58,El desarrollo de nuevas tecnologías es fundamental para el progreso.,The development of new technologies is essential for progress.,./Sentences/Economia/audio/58_Economia_audio.mp3
59,El descenso de la temperatura fue repentino y drástico.,The temperature drop was sudden and drastic.,./Sentences/Economia/audio/59_Economia_audio.mp3
60,La desigualdad económica es un problema grave en muchos países.,Economic inequality is a serious problem in many countries.,./Sentences/Economia/audio/60_Economia_audio.mp3
61,La deuda externa del país ha alcanzado niveles preocupantes.,The country's external debt has reached worrying levels.,./Sentences/Economia/audio/61_Economia_audio.mp3
62,Devaluar la moneda puede tener consecuencias negativas para la economía.,Devaluing the currency can have negative consequences for the economy.,./Sentences/Economia/audio/62_Economia_audio.mp3
63,El dinero en efectivo es cada vez menos utilizado en las transacciones.,Cash money is increasingly less used in transactions.,./Sentences/Economia/audio/63_Economia_audio.mp3
64,El dólar es una de las monedas más utilizadas en el comercio internacional.,The dollar is one of the most widely used currencies in international trade.,./Sentences/Economia/audio/64_Economia_audio.mp3
65,El dueño del restaurante se preocupa por la calidad de los alimentos.,The owner of the restaurant is concerned about the quality of the food.,./Sentences/Economia/audio/65_Economia_audio.mp3
66,La economía de muchos países se ha visto afectada por la pandemia.,The economy of many countries has been affected by the pandemic.,./Sentences/Economia/audio/66_Economia_audio.mp3
67,La economía de guerra tiene características particulares en términos de producción y gasto.,The wartime economy has particular characteristics in terms of production and expenditure.,./Sentences/Economia/audio/67_Economia_audio.mp3
68,"Económicamente, la situación del país es complicada.","Economically, the country's situation is complicated.",./Sentences/Economia/audio/68_Economia_audio.mp3
69,El efectivo es cada vez menos utilizado en las transacciones diarias.,Cash is increasingly less used in daily transactions.,./Sentences/Economia/audio/69_Economia_audio.mp3
70,Los efectos nocivos de la contaminación son evidentes en la salud de las personas.,The harmful effects of pollution are evident in people's health.,./Sentences/Economia/audio/70_Economia_audio.mp3
71,El congreso está debatiendo una nueva ley de impuestos.,Congress is debating a new tax law.,./Sentences/Economia/audio/71_Economia_audio.mp3
72,Las emisiones de fábricas contribuyen al cambio climático.,Factory emissions contribute to climate change.,./Sentences/Economia/audio/72_Economia_audio.mp3
73,El empleo es un tema crucial en la agenda política.,Employment is a crucial issue on the political agenda.,./Sentences/Economia/audio/73_Economia_audio.mp3
74,El empobrecimiento de la población es un problema que preocupa a las autoridades.,The impoverishment of the population is a problem that concerns the authorities.,./Sentences/Economia/audio/74_Economia_audio.mp3
75,La empresa está buscando expandirse a nuevos mercados.,The company is looking to expand into new markets.,./Sentences/Economia/audio/75_Economia_audio.mp3
76,El empresario ha invertido en tecnología para mejorar la productividad.,The entrepreneur has invested in technology to improve productivity.,./Sentences/Economia/audio/76_Economia_audio.mp3
77,Las enfermedades pueden tener un impacto significativo en la economía de un país.,Diseases can have a significant impact on a country's economy.,./Sentences/Economia/audio/77_Economia_audio.mp3
78,La entrevista de trabajo fue muy positiva y espero obtener el puesto.,The job interview was very positive and I hope to get the position.,./Sentences/Economia/audio/78_Economia_audio.mp3
79,Erradicar la pobreza es un objetivo fundamental para el desarrollo sostenible.,Eradicating poverty is a fundamental goal for sustainable development.,./Sentences/Economia/audio/79_Economia_audio.mp3
80,La escasez de alimentos es un problema grave en algunas regiones del mundo.,The scarcity of food is a serious problem in some regions of the world.,./Sentences/Economia/audio/80_Economia_audio.mp3
81,El escenario económico actual presenta desafíos significativos para las empresas.,The current economic scenario presents significant challenges for businesses.,./Sentences/Economia/audio/81_Economia_audio.mp3
82,La estabilidad económica es fundamental para el desarrollo sostenible de un país.,Economic stability is essential for the sustainable development of a country.,./Sentences/Economia/audio/82_Economia_audio.mp3
83,Las estadísticas demuestran un aumento en el desempleo durante el último trimestre.,The statistics show an increase in unemployment during the last quarter.,./Sentences/Economia/audio/83_Economia_audio.mp3
84,Estimular la innovación es clave para el crecimiento de cualquier industria.,Stimulating innovation is key to the growth of any industry.,./Sentences/Economia/audio/84_Economia_audio.mp3
85,La exportación de productos agrícolas es una fuente importante de ingresos para el país.,The export of agricultural products is an important source of income for the country.,./Sentences/Economia/audio/85_Economia_audio.mp3
86,La fábrica ha implementado nuevas tecnologías para mejorar la eficiencia de producción.,The factory has implemented new technologies to improve production efficiency.,./Sentences/Economia/audio/86_Economia_audio.mp3
87,La fabricación de automóviles representa una parte significativa de la industria manufacturera.,The manufacturing of automobiles represents a significant portion of the manufacturing industry.,./Sentences/Economia/audio/87_Economia_audio.mp3
88,Facilitar el acceso a la educación es esencial para el desarrollo de una sociedad equitativa.,Facilitating access to education is essential for the development of an equitable society.,./Sentences/Economia/audio/88_Economia_audio.mp3
89,La feria comercial atrae a miles de visitantes interesados en nuevos productos y servicios.,The trade fair attracts thousands of visitors interested in new products and services.,./Sentences/Economia/audio/89_Economia_audio.mp3
90,Las finanzas personales requieren una planificación cuidadosa para asegurar la estabilidad económica.,Personal finances require careful planning to ensure economic stability.,./Sentences/Economia/audio/90_Economia_audio.mp3
91,Los fondos destinados a la investigación científica son fundamentales para el avance de la medicina.,Funds allocated to scientific research are fundamental for the advancement of medicine.,./Sentences/Economia/audio/91_Economia_audio.mp3
92,Fortalecer la colaboración entre empresas y comunidades puede generar un impacto positivo en el desarrollo local.,Strengthening collaboration between businesses and communities can have a positive impact on local development.,./Sentences/Economia/audio/92_Economia_audio.mp3
93,La franquicia de restaurantes ha abierto una nueva sucursal en el centro de la ciudad.,The restaurant franchise has opened a new branch in the city center.,./Sentences/Economia/audio/93_Economia_audio.mp3
94,La fundación sin fines de lucro se dedica a apoyar proyectos educativos en comunidades desfavorecidas.,The non-profit foundation is dedicated to supporting educational projects in underprivileged communities.,./Sentences/Economia/audio/94_Economia_audio.mp3
95,La ganancia de peso puede estar relacionada con hábitos alimenticios poco saludables.,Weight gain may be related to unhealthy eating habits.,./Sentences/Economia/audio/95_Economia_audio.mp3
96,Las ganancias de la empresa han aumentado significativamente en el último año.,The company's profits have increased significantly in the last year.,./Sentences/Economia/audio/96_Economia_audio.mp3
97,Gastar dinero en experiencias enriquecedoras puede ser más gratificante que adquirir bienes materiales.,Spending money on enriching experiences can be more rewarding than acquiring material goods.,./Sentences/Economia/audio/97_Economia_audio.mp3
98,El gasto en infraestructura es una inversión a largo plazo en el desarrollo del país.,Spending on infrastructure is a long-term investment in the country's development.,./Sentences/Economia/audio/98_Economia_audio.mp3
99,Los gastos operativos deben ser controlados para garantizar la rentabilidad del negocio.,Operating expenses must be controlled to ensure the profitability of the business.,./Sentences/Economia/audio/99_Economia_audio.mp3
100,La globalización ha traído consigo muchos cambios en el mundo actual.,Globalization has brought about many changes in the modern world.,./Sentences/Economia/audio/100_Economia_audio.mp3
101,El gobierno está implementando nuevas políticas para mejorar la economía.,The government is implementing new policies to improve the economy.,./Sentences/Economia/audio/101_Economia_audio.mp3
102,La hipoteca de la casa se pagará en 30 años.,The home mortgage will be paid off in 30 years.,./Sentences/Economia/audio/102_Economia_audio.mp3
103,El hogar es un lugar de refugio y descanso para muchas personas.,Home is a place of refuge and rest for many people.,./Sentences/Economia/audio/103_Economia_audio.mp3
104,La igualdad de género es un objetivo importante en la sociedad actual.,Gender equality is an important goal in today's society.,./Sentences/Economia/audio/104_Economia_audio.mp3
105,La importación de productos extranjeros ha aumentado en los últimos años.,The import of foreign products has increased in recent years.,./Sentences/Economia/audio/105_Economia_audio.mp3
106,Los impuestos son necesarios para financiar los servicios públicos.,Taxes are necessary to fund public services.,./Sentences/Economia/audio/106_Economia_audio.mp3
107,El gobierno quiere impulsar el desarrollo de la industria tecnológica.,The government wants to drive the development of the technology industry.,./Sentences/Economia/audio/107_Economia_audio.mp3
108,Es importante incentivar el uso de energías renovables para proteger el medio ambiente.,It is important to encourage the use of renewable energy to protect the environment.,./Sentences/Economia/audio/108_Economia_audio.mp3
109,La independencia es un valor fundamental para muchas personas.,Independence is a fundamental value for many people.,./Sentences/Economia/audio/109_Economia_audio.mp3
110,El indicador económico muestra signos de recuperación.,The economic indicator shows signs of recovery.,./Sentences/Economia/audio/110_Economia_audio.mp3
111,El índice de desempleo ha disminuido en el último trimestre.,The unemployment rate has decreased in the last quarter.,./Sentences/Economia/audio/111_Economia_audio.mp3
112,La industria del entretenimiento genera miles de empleos en el país.,The entertainment industry generates thousands of jobs in the country.,./Sentences/Economia/audio/112_Economia_audio.mp3
113,La inflación puede afectar el poder adquisitivo de las personas.,Inflation can affect people's purchasing power.,./Sentences/Economia/audio/113_Economia_audio.mp3
114,Los medios de comunicación pueden influir en la opinión pública.,The media can influence public opinion.,./Sentences/Economia/audio/114_Economia_audio.mp3
115,El informe anual de la empresa será presentado la próxima semana.,The company's annual report will be presented next week.,./Sentences/Economia/audio/115_Economia_audio.mp3
116,Los ingresos familiares han aumentado gracias a un nuevo empleo.,Family income has increased thanks to a new job.,./Sentences/Economia/audio/116_Economia_audio.mp3
117,La inmobiliaria está ofreciendo casas a precios asequibles.,The real estate agency is offering houses at affordable prices.,./Sentences/Economia/audio/117_Economia_audio.mp3
118,El intercambio de conocimientos es fundamental para el progreso de la sociedad.,The exchange of knowledge is fundamental for the progress of society.,./Sentences/Economia/audio/118_Economia_audio.mp3
119,El abogado intercedió a favor de su cliente durante el juicio.,The lawyer interceded on behalf of his client during the trial.,./Sentences/Economia/audio/119_Economia_audio.mp3
120,La interdependencia entre los países es cada vez más evidente en la economía global.,The interdependence among countries is increasingly evident in the global economy.,./Sentences/Economia/audio/120_Economia_audio.mp3
121,La interpretación de la obra de teatro fue excepcional.,The interpretation of the play was exceptional.,./Sentences/Economia/audio/121_Economia_audio.mp3
122,La inversión en educación es fundamental para el desarrollo de un país.,Investment in education is fundamental for the development of a country.,./Sentences/Economia/audio/122_Economia_audio.mp3
123,La justicia debe ser imparcial y equitativa para todos los ciudadanos.,Justice must be impartial and equitable for all citizens.,./Sentences/Economia/audio/123_Economia_audio.mp3
124,La ley prohíbe el consumo de alcohol en lugares públicos.,The law prohibits the consumption of alcohol in public places.,./Sentences/Economia/audio/124_Economia_audio.mp3
125,El lujo de viajar en primera clase es una experiencia única.,The luxury of traveling first class is a unique experience.,./Sentences/Economia/audio/125_Economia_audio.mp3
126,La malversación de fondos públicos es un delito grave.,Embezzlement of public funds is a serious crime.,./Sentences/Economia/audio/126_Economia_audio.mp3
127,El mecanismo de funcionamiento del reloj es muy complejo.,The mechanism of the watch's operation is very complex.,./Sentences/Economia/audio/127_Economia_audio.mp3
128,Las medidas tomadas por el gobierno han tenido un impacto positivo en la economía.,The measures taken by the government have had a positive impact on the economy.,./Sentences/Economia/audio/128_Economia_audio.mp3
129,El medio ambiente necesita ser protegido para las futuras generaciones.,The environment needs to be protected for future generations.,./Sentences/Economia/audio/129_Economia_audio.mp3
130,Los medios de comunicación desempeñan un papel crucial en la difusión de información.,The media plays a crucial role in disseminating information.,./Sentences/Economia/audio/130_Economia_audio.mp3
131,El mejoramiento de las condiciones de vida es una prioridad para el gobierno.,Improving living conditions is a priority for the government.,./Sentences/Economia/audio/131_Economia_audio.mp3
132,Mejorar la infraestructura vial es esencial para reducir la congestión del tráfico.,Improving the road infrastructure is essential to reduce traffic congestion.,./Sentences/Economia/audio/132_Economia_audio.mp3
133,El millonario donó una gran suma de dinero a obras de caridad.,The millionaire donated a large sum of money to charity.,./Sentences/Economia/audio/133_Economia_audio.mp3
134,La moneda local se ha depreciado frente al dólar.,The local currency has depreciated against the dollar.,./Sentences/Economia/audio/134_Economia_audio.mp3
135,Es importante monitorear el progreso de los estudiantes para identificar áreas de mejora.,It is important to monitor students' progress to identify areas for improvement.,./Sentences/Economia/audio/135_Economia_audio.mp3
136,La multinacional está expandiendo sus operaciones a nivel internacional.,The multinational is expanding its operations internationally.,./Sentences/Economia/audio/136_Economia_audio.mp3
137,La negociación entre las partes finalmente llegó a un acuerdo satisfactorio.,The negotiation between the parties finally reached a satisfactory agreement.,./Sentences/Economia/audio/137_Economia_audio.mp3
