,Spanish,English,Audio
138,El negocio familiar ha estado operando por más de tres generaciones.,The family business has been operating for over three generations.,./Sentences/Economia/audio/138_Economia_audio.mp3
139,Debes pagar la factura antes de la fecha de vencimiento para evitar cargos adicionales.,You must pay the bill before the due date to avoid additional charges.,./Sentences/Economia/audio/139_Economia_audio.mp3
140,El pago se realizará al final del mes.,The payment will be made at the end of the month.,./Sentences/Economia/audio/140_Economia_audio.mp3
141,Los países desarrollados tienen una economía estable.,Developed countries have a stable economy.,./Sentences/Economia/audio/141_Economia_audio.mp3
142,El agregado económico muestra un crecimiento del 3% este trimestre.,The economic aggregate shows a 3% growth this quarter.,./Sentences/Economia/audio/142_Economia_audio.mp3
143,El desempleo es un problema que afecta a muchas familias.,Unemployment is a problem that affects many families.,./Sentences/Economia/audio/143_Economia_audio.mp3
144,El mercado está experimentando una fuerte competencia.,The market is experiencing strong competition.,./Sentences/Economia/audio/144_Economia_audio.mp3
145,La organización mundial del turismo promueve el desarrollo sostenible del turismo.,The World Tourism Organization promotes sustainable tourism development.,./Sentences/Economia/audio/145_Economia_audio.mp3
146,Los países en desarrollo necesitan apoyo para fortalecer sus economías.,Developing countries need support to strengthen their economies.,./Sentences/Economia/audio/146_Economia_audio.mp3
147,El paquete económico incluye medidas para estimular la inversión.,The economic package includes measures to stimulate investment.,./Sentences/Economia/audio/147_Economia_audio.mp3
148,El paraíso fiscal es objeto de regulaciones internacionales.,The tax haven is subject to international regulations.,./Sentences/Economia/audio/148_Economia_audio.mp3
149,La paz es fundamental para el desarrollo de cualquier nación.,Peace is fundamental for the development of any nation.,./Sentences/Economia/audio/149_Economia_audio.mp3
150,La pequeña y mediana empresa es un motor importante de la economía.,Small and medium-sized enterprises are an important engine of the economy.,./Sentences/Economia/audio/150_Economia_audio.mp3
151,La pérdida de empleos afecta a muchas comunidades.,Job loss affects many communities.,./Sentences/Economia/audio/151_Economia_audio.mp3
152,El/la periodista investiga y reporta noticias de interés público.,The journalist investigates and reports on matters of public interest.,./Sentences/Economia/audio/152_Economia_audio.mp3
153,El peso mexicano se ha depreciado frente al dólar.,The Mexican peso has depreciated against the dollar.,./Sentences/Economia/audio/153_Economia_audio.mp3
154,El pirata informático accedió ilegalmente a la base de datos.,The hacker illegally accessed the database.,./Sentences/Economia/audio/154_Economia_audio.mp3
155,El plagio es una violación grave de los derechos de autor.,Plagiarism is a serious violation of copyright.,./Sentences/Economia/audio/155_Economia_audio.mp3
156,El plan económico busca impulsar el crecimiento del país.,The economic plan aims to boost the country's growth.,./Sentences/Economia/audio/156_Economia_audio.mp3
157,La pobreza es un desafío que requiere atención urgente.,Poverty is a challenge that requires urgent attention.,./Sentences/Economia/audio/157_Economia_audio.mp3
158,El poder adquisitivo de la población ha disminuido debido a la inflación.,The purchasing power of the population has decreased due to inflation.,./Sentences/Economia/audio/158_Economia_audio.mp3
159,La política económica del gobierno busca estabilizar la inflación.,The government's economic policy aims to stabilize inflation.,./Sentences/Economia/audio/159_Economia_audio.mp3
160,El porcentaje de aprobación aumentó en un 10% este año.,The approval percentage increased by 10% this year.,./Sentences/Economia/audio/160_Economia_audio.mp3
161,La práctica comercial debe cumplir con las regulaciones establecidas.,Commercial practice must comply with the established regulations.,./Sentences/Economia/audio/161_Economia_audio.mp3
162,El precio del petróleo ha aumentado en los últimos meses.,The price of oil has increased in the last few months.,./Sentences/Economia/audio/162_Economia_audio.mp3
163,La prensa juega un papel crucial en la sociedad.,The press plays a crucial role in society.,./Sentences/Economia/audio/163_Economia_audio.mp3
164,El préstamo hipotecario fue aprobado por el banco.,The mortgage loan was approved by the bank.,./Sentences/Economia/audio/164_Economia_audio.mp3
165,El presupuesto para el proyecto de construcción es limitado.,The budget for the construction project is limited.,./Sentences/Economia/audio/165_Economia_audio.mp3
166,La producción de energía solar ha aumentado significativamente.,The production of solar energy has increased significantly.,./Sentences/Economia/audio/166_Economia_audio.mp3
167,Los productos de esta empresa son de alta calidad.,The products of this company are of high quality.,./Sentences/Economia/audio/167_Economia_audio.mp3
168,El progreso tecnológico ha transformado nuestra forma de vida.,Technological progress has transformed our way of life.,./Sentences/Economia/audio/168_Economia_audio.mp3
169,Es importante promover la igualdad de género en el lugar de trabajo.,It is important to promote gender equality in the workplace.,./Sentences/Economia/audio/169_Economia_audio.mp3
170,La propiedad intelectual debe ser protegida por la ley.,Intellectual property must be protected by law.,./Sentences/Economia/audio/170_Economia_audio.mp3
171,La prosperidad económica del país ha mejorado en los últimos años.,The country's economic prosperity has improved in recent years.,./Sentences/Economia/audio/171_Economia_audio.mp3
172,El puesto de trabajo requiere habilidades de comunicación efectivas.,The job position requires effective communication skills.,./Sentences/Economia/audio/172_Economia_audio.mp3
173,La recesión económica afectó a muchas empresas el año pasado.,The economic recession affected many companies last year.,./Sentences/Economia/audio/173_Economia_audio.mp3
174,Los recortes en el gasto público han generado controversia.,Budget cuts have generated controversy.,./Sentences/Economia/audio/174_Economia_audio.mp3
175,Los recursos económicos deben ser utilizados de manera eficiente.,Economic resources must be used efficiently.,./Sentences/Economia/audio/175_Economia_audio.mp3
176,Los recursos naturales deben ser preservados para las generaciones futuras.,Natural resources must be preserved for future generations.,./Sentences/Economia/audio/176_Economia_audio.mp3
177,Los recursos naturales no renovables se agotarán eventualmente.,Non-renewable natural resources will eventually be depleted.,./Sentences/Economia/audio/177_Economia_audio.mp3
178,La reducción de emisiones de carbono es crucial para combatir el cambio climático.,Reducing carbon emissions is crucial to combat climate change.,./Sentences/Economia/audio/178_Economia_audio.mp3
179,Es importante reducir el consumo de plástico para proteger el medio ambiente.,It is important to reduce plastic consumption to protect the environment.,./Sentences/Economia/audio/179_Economia_audio.mp3
180,La regulación es necesaria para garantizar la seguridad de los productos.,Regulation is necessary to ensure the safety of products.,./Sentences/Economia/audio/180_Economia_audio.mp3
181,Es importante reportar cualquier incidente sospechoso a las autoridades.,It is important to report any suspicious incident to the authorities.,./Sentences/Economia/audio/181_Economia_audio.mp3
182,Los requisitos para obtener la licencia de conducir han cambiado.,The requirements to obtain a driver's license have changed.,./Sentences/Economia/audio/182_Economia_audio.mp3
183,El resumen del libro ofrece una visión general de la trama.,The summary of the book provides an overview of the plot.,./Sentences/Economia/audio/183_Economia_audio.mp3
184,La riqueza de recursos naturales de este país es impresionante.,The wealth of natural resources in this country is impressive.,./Sentences/Economia/audio/184_Economia_audio.mp3
185,El salario de los empleados ha aumentado este año.,The employees' salary has increased this year.,./Sentences/Economia/audio/185_Economia_audio.mp3
186,La salud es un aspecto fundamental para el bienestar general.,Health is a fundamental aspect for overall well-being.,./Sentences/Economia/audio/186_Economia_audio.mp3
187,La sanción por exceso de velocidad puede ser una multa considerable.,The penalty for speeding can be a significant fine.,./Sentences/Economia/audio/187_Economia_audio.mp3
188,La sección económica del periódico ofrece análisis detallados.,The economic section of the newspaper offers detailed analysis.,./Sentences/Economia/audio/188_Economia_audio.mp3
189,El sector de la tecnología está experimentando un rápido crecimiento.,The technology sector is experiencing rapid growth.,./Sentences/Economia/audio/189_Economia_audio.mp3
190,El senador presentó un proyecto de ley para mejorar la educación.,The senator introduced a bill to improve education.,./Sentences/Economia/audio/190_Economia_audio.mp3
191,Los servicios de emergencia respondieron rápidamente al llamado.,Emergency services responded quickly to the call.,./Sentences/Economia/audio/191_Economia_audio.mp3
192,El sistema comercial internacional está sujeto a constantes cambios.,The international trade system is subject to constant changes.,./Sentences/Economia/audio/192_Economia_audio.mp3
193,El sistema multilateral de cooperación es crucial para la paz mundial.,The multilateral cooperation system is crucial for world peace.,./Sentences/Economia/audio/193_Economia_audio.mp3
194,El soborno es un delito grave que socava la integridad.,Bribery is a serious crime that undermines integrity.,./Sentences/Economia/audio/194_Economia_audio.mp3
195,La solvencia económica de la empresa se vio afectada por la crisis.,The economic solvency of the company was affected by the crisis.,./Sentences/Economia/audio/195_Economia_audio.mp3
196,El subsidio gubernamental ayudará a impulsar la industria agrícola.,The government subsidy will help boost the agricultural industry.,./Sentences/Economia/audio/196_Economia_audio.mp3
197,El sueldo de los trabajadores se determina de acuerdo con su experiencia.,Workers' salary is determined according to their experience.,./Sentences/Economia/audio/197_Economia_audio.mp3
198,El sueldo mínimo es el salario más bajo que un empleador puede pagar legalmente.,The minimum wage is the lowest salary that an employer can legally pay.,./Sentences/Economia/audio/198_Economia_audio.mp3
199,Los suministros médicos son esenciales para la atención de la salud.,Medical supplies are essential for healthcare.,./Sentences/Economia/audio/199_Economia_audio.mp3
200,La tarifa del autobús aumentó este mes.,The bus fare increased this month.,./Sentences/Economia/audio/200_Economia_audio.mp3
201,Necesito una nueva tarjeta de crédito porque la mía está vencida.,I need a new credit card because mine has expired.,./Sentences/Economia/audio/201_Economia_audio.mp3
202,La tasa de interés de mi préstamo hipotecario es muy alta.,The interest rate on my mortgage loan is very high.,./Sentences/Economia/audio/202_Economia_audio.mp3
203,La tecnología moderna ha transformado la forma en que nos comunicamos.,Modern technology has transformed the way we communicate.,./Sentences/Economia/audio/203_Economia_audio.mp3
204,La tesorería de la empresa se encarga de administrar los fondos.,The company's treasury is responsible for managing the funds.,./Sentences/Economia/audio/204_Economia_audio.mp3
205,Voy a la tienda a comprar algunas frutas y verduras.,I'm going to the store to buy some fruits and vegetables.,./Sentences/Economia/audio/205_Economia_audio.mp3
206,El acuerdo de libre comercio beneficiará a ambos países.,The free trade agreement will benefit both countries.,./Sentences/Economia/audio/206_Economia_audio.mp3
207,Realicé una transacción bancaria para transferir dinero a mi cuenta de ahorros.,I made a bank transaction to transfer money to my savings account.,./Sentences/Economia/audio/207_Economia_audio.mp3
208,La empresa transnacional tiene sucursales en varios países.,The transnational company has branches in several countries.,./Sentences/Economia/audio/208_Economia_audio.mp3
209,El tratado de paz puso fin a años de conflicto en la región.,The peace treaty put an end to years of conflict in the region.,./Sentences/Economia/audio/209_Economia_audio.mp3
210,El turismo es una fuente importante de ingresos para esta ciudad.,Tourism is an important source of income for this city.,./Sentences/Economia/audio/210_Economia_audio.mp3
211,Los turistas disfrutaron de las playas y el clima cálido.,The tourists enjoyed the beaches and the warm weather.,./Sentences/Economia/audio/211_Economia_audio.mp3
212,El valor de la amistad es incalculable.,The value of friendship is immeasurable.,./Sentences/Economia/audio/212_Economia_audio.mp3
213,Los vendedores ambulantes ofrecen una variedad de productos en la calle.,Street vendors offer a variety of products on the street.,./Sentences/Economia/audio/213_Economia_audio.mp3
214,Quiero vender mi coche para comprar uno nuevo.,I want to sell my car to buy a new one.,./Sentences/Economia/audio/214_Economia_audio.mp3
215,La venta de boletos para el concierto comenzará mañana.,The ticket sale for the concert will start tomorrow.,./Sentences/Economia/audio/215_Economia_audio.mp3
216,El vínculo entre hermanos es especial y duradero.,The bond between siblings is special and enduring.,./Sentences/Economia/audio/216_Economia_audio.mp3
217,Los niños en situación de calle son especialmente vulnerables.,Children living on the streets are especially vulnerable.,./Sentences/Economia/audio/217_Economia_audio.mp3